{"$schema":"https://json-schema.org/draft/2020-12/schema","$id":"https://github.com/newcovid/nonebot-plugin-yijing/data/schemas/guaci.schema.json","title":"guaci","description":"Hexagram judgment text.","type":"array","items":{"type":"object","additionalProperties":true,"required":["hexagram_seq","hexagram_name","text","source_id","status"],"properties":{"hexagram_seq":{"type":"integer","minimum":1,"maximum":64},"hexagram_name":{"type":"string"},"text":{"type":"string"},"source_id":{"type":"string","minLength":1},"status":{"type":"string","enum":["placeholder","draft","seeded","checked","verified"]},"edition":{"type":"string"},"source_locator":{"type":"string"},"collation_notes":{"type":"string"}}}}
